{
  "$schema": "https://json-schema.org/draft/2020-12/schema",
  "title": "Graybeard Reasoning Ledger",
  "type": "object",
  "required": ["risk", "confidence", "facts", "invariants", "decision", "validation"],
  "properties": {
    "risk": { "enum": ["LOW", "MEDIUM", "HIGH"] },
    "confidence": { "type": "number", "minimum": 0, "maximum": 1 },
    "facts": { "type": "array", "items": { "type": "string" } },
    "unknown": { "type": "array", "items": { "type": "string" } },
    "invariants": { "type": "array", "items": { "type": "string" } },
    "candidates": { "type": "array", "items": { "type": "string" } },
    "rejected": { "type": "array", "items": { "type": "string" } },
    "decision": { "type": "string" },
    "validation": { "type": "array", "items": { "type": "string" } }
  },
  "additionalProperties": false
}
